{
  "scryfall_id": "b10d99bf-b2ce-4443-b924-ff0eb8be1033",
  "mtgjson_uuid": null,
  "name": "Finale of Devastation",
  "oracle_text": "Search your library and/or graveyard for a creature card with mana value X or less and put it onto the battlefield. If you search your library this way, shuffle. If X is 10 or more, creatures you control get +X/+X and gain haste until end of turn.",
  "type_line": "Sorcery",
  "color_identity": [
    "G"
  ],
  "mana_cost": "{X}{G}{G}",
  "mana_value": 2.0,
  "characteristics": {
    "card_types": [
      "Sorcery"
    ],
    "subtypes": [],
    "supertypes": [],
    "is_mana_source": false,
    "is_creature": false,
    "is_permanent": false,
    "power": null,
    "toughness": null,
    "produces_convoke_eligible": false,
    "notes": [
      "Ability `kind` classification is a rule-based heuristic text-line parser (sim/ingestion/scryfall.py), not manually reviewed. Verify before Level 4 exact-line validation use."
    ]
  },
  "abilities": [
    {
      "kind": "static",
      "text": "Search your library and/or graveyard for a creature card with mana value X or less and put it onto the battlefield. If you search your library this way, shuffle. If X is 10 or more, creatures you control get +X/+X and gain haste until end of turn.",
      "cost": null,
      "timing_restriction": null,
      "zone_restriction": null,
      "alternative_cost": null
    }
  ],
  "tutor_restrictions": null,
  "commander_interactions": [],
  "rulings": [
    {
      "date": "2019-05-03",
      "text": "If a creature card in your library or graveyard has {X} in its mana cost, X is considered to be 0.",
      "source": "scryfall_rulings"
    },
    {
      "date": "2019-05-03",
      "text": "If X is 10 or more, the creature card you just put onto the battlefield will get +X/+X and haste.",
      "source": "scryfall_rulings"
    },
    {
      "date": "2019-05-03",
      "text": "No player may take action between the time you reveal which creature card you'll put onto the battlefield and the time it gets +X/+X and haste if X is 10 or more. Any abilities that trigger as it enters the battlefield will be put onto the stack after your creatures get +X/+X and haste.",
      "source": "scryfall_rulings"
    },
    {
      "date": "2019-05-03",
      "text": "If you don't find a creature card with mana value X or less, creatures you control still get +X/+X and gain haste if X is 10 or more.",
      "source": "scryfall_rulings"
    }
  ],
  "legalities": {
    "standard": "not_legal",
    "future": "not_legal",
    "historic": "legal",
    "timeless": "legal",
    "gladiator": "legal",
    "pioneer": "legal",
    "modern": "legal",
    "legacy": "legal",
    "pauper": "not_legal",
    "vintage": "legal",
    "penny": "not_legal",
    "commander": "legal",
    "oathbreaker": "legal",
    "standardbrawl": "not_legal",
    "brawl": "legal",
    "competitivebrawl": "legal",
    "alchemy": "not_legal",
    "paupercommander": "not_legal",
    "duel": "legal",
    "oldschool": "not_legal",
    "premodern": "not_legal",
    "predh": "not_legal",
    "tlr": "legal"
  },
  "source_pull_date": "2026-08-12",
  "source_version": "scryfall-live-2026-08-12"
}
