{
  "scryfall_id": "fc7d1912-7e27-49ef-bd98-375d975a42b0",
  "mtgjson_uuid": null,
  "name": "Starting Town",
  "oracle_text": "This land enters tapped unless it's your first, second, or third turn of the game.\n{T}: Add {C}.\n{T}, Pay 1 life: Add one mana of any color.",
  "type_line": "Land \u2014 Town",
  "color_identity": [],
  "mana_cost": "",
  "mana_value": 0.0,
  "characteristics": {
    "card_types": [
      "Land"
    ],
    "subtypes": [
      "Town"
    ],
    "supertypes": [],
    "is_mana_source": true,
    "is_creature": false,
    "is_permanent": true,
    "power": null,
    "toughness": null,
    "produces_convoke_eligible": false,
    "notes": [
      "Ability `kind` classification is a rule-based heuristic text-line parser (sim/ingestion/scryfall.py), not manually reviewed. Verify before Level 4 exact-line validation use."
    ]
  },
  "abilities": [
    {
      "kind": "static",
      "text": "This land enters tapped unless it's your first, second, or third turn of the game.",
      "cost": null,
      "timing_restriction": null,
      "zone_restriction": null,
      "alternative_cost": null
    },
    {
      "kind": "mana",
      "text": "{T}: Add {C}.",
      "cost": "{T}",
      "timing_restriction": null,
      "zone_restriction": null,
      "alternative_cost": null
    },
    {
      "kind": "mana",
      "text": "{T}, Pay 1 life: Add one mana of any color.",
      "cost": "{T}, Pay 1 life",
      "timing_restriction": null,
      "zone_restriction": null,
      "alternative_cost": null
    }
  ],
  "tutor_restrictions": null,
  "commander_interactions": [],
  "rulings": [
    {
      "date": "2025-06-06",
      "text": "Town is a land type with no special meaning. It doesn't grant the land any intrinsic abilities. Other cards may care about which lands are Towns.",
      "source": "scryfall_rulings"
    }
  ],
  "legalities": {
    "standard": "legal",
    "future": "legal",
    "historic": "legal",
    "timeless": "legal",
    "gladiator": "legal",
    "pioneer": "legal",
    "modern": "legal",
    "legacy": "legal",
    "pauper": "not_legal",
    "vintage": "legal",
    "penny": "not_legal",
    "commander": "legal",
    "oathbreaker": "legal",
    "standardbrawl": "legal",
    "brawl": "legal",
    "competitivebrawl": "legal",
    "alchemy": "legal",
    "paupercommander": "not_legal",
    "duel": "legal",
    "oldschool": "not_legal",
    "premodern": "not_legal",
    "predh": "not_legal",
    "tlr": "legal"
  },
  "source_pull_date": "2026-10-30",
  "source_version": "scryfall-live-2026-10-30"
}
