{
  "scryfall_id": "701256d5-1389-48b7-9581-d6037209bd06",
  "mtgjson_uuid": null,
  "name": "Subtlety",
  "oracle_text": "Flash\nFlying\nWhen this creature enters, choose up to one target creature spell or planeswalker spell. Its owner puts it on their choice of the top or bottom of their library.\nEvoke\u2014Exile a blue card from your hand.",
  "type_line": "Creature \u2014 Elemental Incarnation",
  "color_identity": [
    "U"
  ],
  "mana_cost": "{2}{U}{U}",
  "mana_value": 4.0,
  "characteristics": {
    "card_types": [
      "Creature"
    ],
    "subtypes": [
      "Elemental",
      "Incarnation"
    ],
    "supertypes": [],
    "is_mana_source": false,
    "is_creature": true,
    "is_permanent": true,
    "power": "3",
    "toughness": "3",
    "produces_convoke_eligible": true,
    "notes": [
      "Ability `kind` classification is a rule-based heuristic text-line parser (sim/ingestion/scryfall.py), not manually reviewed. Verify before Level 4 exact-line validation use."
    ]
  },
  "abilities": [
    {
      "kind": "static",
      "text": "Flash",
      "cost": null,
      "timing_restriction": null,
      "zone_restriction": null,
      "alternative_cost": null
    },
    {
      "kind": "static",
      "text": "Flying",
      "cost": null,
      "timing_restriction": null,
      "zone_restriction": null,
      "alternative_cost": null
    },
    {
      "kind": "triggered",
      "text": "When this creature enters, choose up to one target creature spell or planeswalker spell. Its owner puts it on their choice of the top or bottom of their library.",
      "cost": null,
      "timing_restriction": null,
      "zone_restriction": null,
      "alternative_cost": null
    },
    {
      "kind": "static",
      "text": "Evoke\u2014Exile a blue card from your hand.",
      "cost": null,
      "timing_restriction": null,
      "zone_restriction": null,
      "alternative_cost": null
    }
  ],
  "tutor_restrictions": null,
  "commander_interactions": [],
  "rulings": [
    {
      "date": "2021-06-18",
      "text": "Subtlety's triggered ability targets a spell on the stack. It can't target creatures or planeswalkers on the battlefield.",
      "source": "scryfall_rulings"
    },
    {
      "date": "2021-06-18",
      "text": "A spell that's put into its owner's library doesn't resolve, but it isn't countered. This will work on spells that say they can't be countered.",
      "source": "scryfall_rulings"
    },
    {
      "date": "2021-06-18",
      "text": "The owner of the spell is the one who chooses whether it goes on the top or bottom of their library. All players will know this information.",
      "source": "scryfall_rulings"
    },
    {
      "date": "2021-06-18",
      "text": "To determine the total cost of a spell, start with the mana cost or alternative cost you're paying (such as an evoke cost), add any cost increases, then apply any cost reductions. The mana value of the spell is determined by only its mana cost, no matter what the total cost to cast that spell was.",
      "source": "scryfall_rulings"
    },
    {
      "date": "2021-06-18",
      "text": "If you pay the evoke cost, you can have the creature's own triggered ability resolve before the evoke triggered ability. You can cast spells after that ability resolves but before you have to sacrifice the creature.",
      "source": "scryfall_rulings"
    }
  ],
  "legalities": {
    "standard": "not_legal",
    "future": "not_legal",
    "historic": "banned",
    "timeless": "legal",
    "gladiator": "legal",
    "pioneer": "not_legal",
    "modern": "legal",
    "legacy": "legal",
    "pauper": "not_legal",
    "vintage": "legal",
    "penny": "not_legal",
    "commander": "legal",
    "oathbreaker": "legal",
    "standardbrawl": "not_legal",
    "brawl": "banned",
    "competitivebrawl": "legal",
    "alchemy": "not_legal",
    "paupercommander": "not_legal",
    "duel": "legal",
    "oldschool": "not_legal",
    "premodern": "not_legal",
    "predh": "not_legal",
    "tlr": "not_legal"
  },
  "source_pull_date": "2026-08-12",
  "source_version": "scryfall-live-2026-08-12"
}
