{
  "scryfall_id": "08b9a296-3b76-4f8f-9d71-7c9af92bb3b4",
  "mtgjson_uuid": null,
  "name": "Elvish Mystic",
  "oracle_text": "{T}: Add {G}.",
  "type_line": "Creature \u2014 Elf Druid",
  "color_identity": [
    "G"
  ],
  "mana_cost": "{G}",
  "mana_value": 1.0,
  "characteristics": {
    "card_types": [
      "Creature"
    ],
    "subtypes": [
      "Elf",
      "Druid"
    ],
    "supertypes": [],
    "is_mana_source": true,
    "is_creature": true,
    "is_permanent": true,
    "power": "1",
    "toughness": "1",
    "produces_convoke_eligible": true,
    "notes": [
      "Ability `kind` classification is a rule-based heuristic text-line parser (sim/ingestion/scryfall.py), not manually reviewed. Verify before Level 4 exact-line validation use."
    ]
  },
  "abilities": [
    {
      "kind": "mana",
      "text": "{T}: Add {G}.",
      "cost": "{T}",
      "timing_restriction": null,
      "zone_restriction": null,
      "alternative_cost": null
    }
  ],
  "tutor_restrictions": null,
  "commander_interactions": [],
  "rulings": [],
  "legalities": {
    "standard": "not_legal",
    "future": "not_legal",
    "historic": "legal",
    "timeless": "legal",
    "gladiator": "legal",
    "pioneer": "legal",
    "modern": "legal",
    "legacy": "legal",
    "pauper": "legal",
    "vintage": "legal",
    "penny": "not_legal",
    "commander": "legal",
    "oathbreaker": "legal",
    "standardbrawl": "not_legal",
    "brawl": "legal",
    "competitivebrawl": "legal",
    "alchemy": "not_legal",
    "paupercommander": "legal",
    "duel": "legal",
    "oldschool": "not_legal",
    "premodern": "not_legal",
    "predh": "not_legal",
    "tlr": "legal"
  },
  "source_pull_date": "2026-10-30",
  "source_version": "scryfall-live-2026-10-30"
}
