{
  "scryfall_id": "991c27ed-f53c-48c6-8c12-282f44b8d441",
  "mtgjson_uuid": null,
  "name": "Training Grounds",
  "oracle_text": "Activated abilities of creatures you control cost {2} less to activate. This effect can't reduce the mana in that cost to less than one mana.",
  "type_line": "Enchantment",
  "color_identity": [
    "U"
  ],
  "mana_cost": "{U}",
  "mana_value": 1.0,
  "characteristics": {
    "card_types": [
      "Enchantment"
    ],
    "subtypes": [],
    "supertypes": [],
    "is_mana_source": false,
    "is_creature": false,
    "is_permanent": true,
    "power": null,
    "toughness": null,
    "produces_convoke_eligible": false,
    "notes": [
      "Ability `kind` classification is a rule-based heuristic text-line parser (sim/ingestion/scryfall.py), not manually reviewed. Verify before Level 4 exact-line validation use."
    ]
  },
  "abilities": [
    {
      "kind": "static",
      "text": "Activated abilities of creatures you control cost {2} less to activate. This effect can't reduce the mana in that cost to less than one mana.",
      "cost": null,
      "timing_restriction": null,
      "zone_restriction": null,
      "alternative_cost": null
    }
  ],
  "tutor_restrictions": null,
  "commander_interactions": [],
  "rulings": [
    {
      "date": "2025-10-02",
      "text": "Training Grounds affects only creatures you control on the battlefield. The costs of activated abilities that work in other zones (such as cycling or unearth) won't be reduced.",
      "source": "scryfall_rulings"
    },
    {
      "date": "2025-10-02",
      "text": "Training Grounds can reduce the amount you pay for a creature's activated ability cost that includes {X}. For example, Drana, Kalastria Bloodchief has an activated ability that costs {X}{B}{B}. If you control Training Grounds and you activate the ability with X equal to 5, you'll have to pay only {3}{B}{B}. This is true even if the ability states that {X} must be paid with a certain color of mana, as Crimson Hellkite's ability does.",
      "source": "scryfall_rulings"
    },
    {
      "date": "2025-10-02",
      "text": "Training Grounds takes the total cost to activate a creature's activated ability into account, not just the cost printed on it. For example, Urabrask has an activated ability that costs {R}, and Suppression Field says \"Activated abilities cost {2} more to activate unless they're mana abilities.\" Since activating Urabrask's activated ability would now cost {2}{R}, Training Grounds reduces that cost back to {R}.",
      "source": "scryfall_rulings"
    },
    {
      "date": "2025-10-02",
      "text": "If an activated ability of a creature you control costs no generic mana to activate (for example, if it costs {R}{R}, it costs {0}, or it costs only nonmana actions such as {T} or \"Sacrifice a creature\"), Training Grounds simply won't affect it. In particular, it won't increase the cost to include a mana payment of {1}.",
      "source": "scryfall_rulings"
    },
    {
      "date": "2025-10-02",
      "text": "Training Grounds reduces the generic mana in waterbend costs for activated abilities. It will not reduce waterbend costs that are additional costs for casting spells.",
      "source": "scryfall_rulings"
    },
    {
      "date": "2025-10-02",
      "text": "Training Grounds won't affect the part of an activation cost represented by colored mana symbols or snow mana symbols. It also won't affect nonmana parts of an activation cost, if there are any.",
      "source": "scryfall_rulings"
    },
    {
      "date": "2025-10-02",
      "text": "Training Grounds can reduce the part of an activation cost represented by generic mana symbols down to nothing, as long as it still costs at least one mana. For example, if an activation cost is {2}{G}, you'd have to pay only {G}. If an activation cost is {2}, though, you'd still have to pay {1}.",
      "source": "scryfall_rulings"
    },
    {
      "date": "2010-06-15",
      "text": "Training Grounds won't affect a cost that isn't the cost to activate a creature's activated ability. For example, it won't affect Flameblast Dragon's {X}{R} cost, since that's a cost paid when a triggered ability resolves, and it won't affect a kicker cost, since that's an additional cost to cast a spell. Activated ability costs appear before a colon (:) in a card's rules text, or, in the case of some keywords, before a colon in reminder text.",
      "source": "scryfall_rulings"
    }
  ],
  "legalities": {
    "standard": "not_legal",
    "future": "not_legal",
    "historic": "legal",
    "timeless": "legal",
    "gladiator": "legal",
    "pioneer": "legal",
    "modern": "legal",
    "legacy": "legal",
    "pauper": "not_legal",
    "vintage": "legal",
    "penny": "legal",
    "commander": "legal",
    "oathbreaker": "legal",
    "standardbrawl": "not_legal",
    "brawl": "legal",
    "competitivebrawl": "legal",
    "alchemy": "not_legal",
    "paupercommander": "not_legal",
    "duel": "legal",
    "oldschool": "not_legal",
    "premodern": "not_legal",
    "predh": "legal",
    "tlr": "legal"
  },
  "source_pull_date": "2026-10-30",
  "source_version": "scryfall-live-2026-10-30"
}
