{
  "scryfall_id": "523414cb-f8db-407a-808a-01454e03d8b9",
  "mtgjson_uuid": null,
  "name": "Crop Rotation",
  "oracle_text": "As an additional cost to cast this spell, sacrifice a land.\nSearch your library for a land card, put that card onto the battlefield, then shuffle.",
  "type_line": "Instant",
  "color_identity": [
    "G"
  ],
  "mana_cost": "{G}",
  "mana_value": 1.0,
  "characteristics": {
    "card_types": [
      "Instant"
    ],
    "subtypes": [],
    "supertypes": [],
    "is_mana_source": false,
    "is_creature": false,
    "is_permanent": false,
    "power": null,
    "toughness": null,
    "produces_convoke_eligible": false,
    "notes": [
      "Ability `kind` classification is a rule-based heuristic text-line parser (sim/ingestion/scryfall.py), not manually reviewed. Verify before Level 4 exact-line validation use."
    ]
  },
  "abilities": [
    {
      "kind": "static",
      "text": "As an additional cost to cast this spell, sacrifice a land.",
      "cost": null,
      "timing_restriction": null,
      "zone_restriction": null,
      "alternative_cost": "As an additional cost to cast this spell, sacrifice a land."
    },
    {
      "kind": "static",
      "text": "Search your library for a land card, put that card onto the battlefield, then shuffle.",
      "cost": null,
      "timing_restriction": null,
      "zone_restriction": null,
      "alternative_cost": null
    }
  ],
  "tutor_restrictions": null,
  "commander_interactions": [],
  "rulings": [
    {
      "date": "2022-12-08",
      "text": "You can\u2019t cast Crop Rotation without sacrificing a land, and you can\u2019t sacrifice additional lands.",
      "source": "scryfall_rulings"
    }
  ],
  "legalities": {
    "standard": "not_legal",
    "future": "not_legal",
    "historic": "banned",
    "timeless": "legal",
    "gladiator": "legal",
    "pioneer": "not_legal",
    "modern": "not_legal",
    "legacy": "legal",
    "pauper": "legal",
    "vintage": "legal",
    "penny": "not_legal",
    "commander": "legal",
    "oathbreaker": "legal",
    "standardbrawl": "not_legal",
    "brawl": "legal",
    "competitivebrawl": "legal",
    "alchemy": "not_legal",
    "paupercommander": "legal",
    "duel": "legal",
    "oldschool": "not_legal",
    "premodern": "legal",
    "predh": "legal",
    "tlr": "legal"
  },
  "source_pull_date": "2026-08-12",
  "source_version": "scryfall-live-2026-08-12"
}
