{
  "scryfall_id": "1ed4c0bb-b710-44a1-b8bc-6bd11c27b8b8",
  "mtgjson_uuid": null,
  "name": "Pact of Negation",
  "oracle_text": "Counter target spell.\nAt the beginning of your next upkeep, pay {3}{U}{U}. If you don't, you lose the game.",
  "type_line": "Instant",
  "color_identity": [
    "U"
  ],
  "mana_cost": "{0}",
  "mana_value": 0.0,
  "characteristics": {
    "card_types": [
      "Instant"
    ],
    "subtypes": [],
    "supertypes": [],
    "is_mana_source": false,
    "is_creature": false,
    "is_permanent": false,
    "power": null,
    "toughness": null,
    "produces_convoke_eligible": false,
    "notes": [
      "Ability `kind` classification is a rule-based heuristic text-line parser (sim/ingestion/scryfall.py), not manually reviewed. Verify before Level 4 exact-line validation use."
    ]
  },
  "abilities": [
    {
      "kind": "static",
      "text": "Counter target spell.",
      "cost": null,
      "timing_restriction": null,
      "zone_restriction": null,
      "alternative_cost": null
    },
    {
      "kind": "triggered",
      "text": "At the beginning of your next upkeep, pay {3}{U}{U}. If you don't, you lose the game.",
      "cost": null,
      "timing_restriction": null,
      "zone_restriction": null,
      "alternative_cost": null
    }
  ],
  "tutor_restrictions": null,
  "commander_interactions": [],
  "rulings": [
    {
      "date": "2021-03-19",
      "text": "If Pact of Negation is countered or otherwise doesn't resolve (perhaps because its target became illegal), the delayed triggered ability that threatens you with a game loss won't trigger at the beginning of your next upkeep.",
      "source": "scryfall_rulings"
    },
    {
      "date": "2021-03-19",
      "text": "If Pact of Negation resolves with a legal target but fails to counter that spell (most likely because that spell can't be countered), the delayed triggered ability will still trigger at the beginning of your next upkeep and you will have to pay. Or else.",
      "source": "scryfall_rulings"
    },
    {
      "date": "2013-06-07",
      "text": "Although originally printed with a characteristic-defining ability that defined its color, this card now has a color indicator. This color indicator can't be affected by text-changing effects (such as the one created by Crystal Spray), although color-changing effects can still overwrite it.",
      "source": "scryfall_rulings"
    }
  ],
  "legalities": {
    "standard": "not_legal",
    "future": "not_legal",
    "historic": "legal",
    "timeless": "legal",
    "gladiator": "legal",
    "pioneer": "not_legal",
    "modern": "legal",
    "legacy": "legal",
    "pauper": "not_legal",
    "vintage": "legal",
    "penny": "not_legal",
    "commander": "legal",
    "oathbreaker": "legal",
    "standardbrawl": "not_legal",
    "brawl": "legal",
    "competitivebrawl": "legal",
    "alchemy": "not_legal",
    "paupercommander": "not_legal",
    "duel": "legal",
    "oldschool": "not_legal",
    "premodern": "not_legal",
    "predh": "legal",
    "tlr": "legal"
  },
  "source_pull_date": "2026-10-30",
  "source_version": "scryfall-live-2026-10-30"
}
