{
  "scryfall_id": "4e11ea8a-f895-438d-a3b7-f070238e4161",
  "mtgjson_uuid": null,
  "name": "Wooded Foothills",
  "oracle_text": "{T}, Pay 1 life, Sacrifice this land: Search your library for a Mountain or Forest card, put it onto the battlefield, then shuffle.",
  "type_line": "Land",
  "color_identity": [],
  "mana_cost": "",
  "mana_value": 0.0,
  "characteristics": {
    "card_types": [
      "Land"
    ],
    "subtypes": [],
    "supertypes": [],
    "is_mana_source": true,
    "is_creature": false,
    "is_permanent": true,
    "power": null,
    "toughness": null,
    "produces_convoke_eligible": false,
    "notes": [
      "Ability `kind` classification is a rule-based heuristic text-line parser (sim/ingestion/scryfall.py), not manually reviewed. Verify before Level 4 exact-line validation use."
    ]
  },
  "abilities": [
    {
      "kind": "activated",
      "text": "{T}, Pay 1 life, Sacrifice this land: Search your library for a Mountain or Forest card, put it onto the battlefield, then shuffle.",
      "cost": "{T}, Pay 1 life, Sacrifice this land",
      "timing_restriction": null,
      "zone_restriction": null,
      "alternative_cost": null
    }
  ],
  "tutor_restrictions": null,
  "commander_interactions": [],
  "rulings": [],
  "legalities": {
    "standard": "not_legal",
    "future": "not_legal",
    "historic": "banned",
    "timeless": "legal",
    "gladiator": "legal",
    "pioneer": "banned",
    "modern": "legal",
    "legacy": "legal",
    "pauper": "not_legal",
    "vintage": "legal",
    "penny": "not_legal",
    "commander": "legal",
    "oathbreaker": "legal",
    "standardbrawl": "not_legal",
    "brawl": "legal",
    "competitivebrawl": "legal",
    "alchemy": "not_legal",
    "paupercommander": "not_legal",
    "duel": "legal",
    "oldschool": "not_legal",
    "premodern": "legal",
    "predh": "legal",
    "tlr": "legal"
  },
  "source_pull_date": "2026-08-12",
  "source_version": "scryfall-live-2026-08-12"
}
