{
  "scryfall_id": "9f37c5b6-a59c-45cd-9a99-e9357fe9ea1b",
  "mtgjson_uuid": null,
  "name": "Rhystic Study",
  "oracle_text": "Whenever an opponent casts a spell, you may draw a card unless that player pays {1}.",
  "type_line": "Enchantment",
  "color_identity": [
    "U"
  ],
  "mana_cost": "{2}{U}",
  "mana_value": 3.0,
  "characteristics": {
    "card_types": [
      "Enchantment"
    ],
    "subtypes": [],
    "supertypes": [],
    "is_mana_source": false,
    "is_creature": false,
    "is_permanent": true,
    "power": null,
    "toughness": null,
    "produces_convoke_eligible": false,
    "notes": [
      "Ability `kind` classification is a rule-based heuristic text-line parser (sim/ingestion/scryfall.py), not manually reviewed. Verify before Level 4 exact-line validation use."
    ]
  },
  "abilities": [
    {
      "kind": "triggered",
      "text": "Whenever an opponent casts a spell, you may draw a card unless that player pays {1}.",
      "cost": null,
      "timing_restriction": null,
      "zone_restriction": null,
      "alternative_cost": null
    }
  ],
  "tutor_restrictions": null,
  "commander_interactions": [],
  "rulings": [
    {
      "date": "2023-09-01",
      "text": "Rhystic Study's triggered ability resolves before the spell that caused it to trigger. It resolves even if that spell is countered. The player gets the option to pay when this triggered ability resolves.",
      "source": "scryfall_rulings"
    },
    {
      "date": "2023-09-01",
      "text": "You don't have to decide whether or not to draw a card until after the player decides whether or not to pay.",
      "source": "scryfall_rulings"
    }
  ],
  "legalities": {
    "standard": "not_legal",
    "future": "not_legal",
    "historic": "legal",
    "timeless": "legal",
    "gladiator": "legal",
    "pioneer": "not_legal",
    "modern": "not_legal",
    "legacy": "legal",
    "pauper": "legal",
    "vintage": "legal",
    "penny": "not_legal",
    "commander": "legal",
    "oathbreaker": "legal",
    "standardbrawl": "not_legal",
    "brawl": "legal",
    "competitivebrawl": "legal",
    "alchemy": "not_legal",
    "paupercommander": "banned",
    "duel": "legal",
    "oldschool": "not_legal",
    "premodern": "legal",
    "predh": "legal",
    "tlr": "legal"
  },
  "source_pull_date": "2026-10-30",
  "source_version": "scryfall-live-2026-10-30"
}
