{
  "scryfall_id": "975dcfab-0281-4fee-92aa-021ea6c524c7",
  "mtgjson_uuid": null,
  "name": "Swift Reconfiguration",
  "oracle_text": "Flash\nEnchant creature or Vehicle\nEnchanted permanent is a Vehicle artifact with crew 5 and it loses all other card types. (It's not a creature unless it's crewed.)",
  "type_line": "Enchantment \u2014 Aura",
  "color_identity": [
    "W"
  ],
  "mana_cost": "{W}",
  "mana_value": 1.0,
  "characteristics": {
    "card_types": [
      "Enchantment"
    ],
    "subtypes": [
      "Aura"
    ],
    "supertypes": [],
    "is_mana_source": false,
    "is_creature": false,
    "is_permanent": true,
    "power": null,
    "toughness": null,
    "produces_convoke_eligible": false,
    "notes": [
      "Ability `kind` classification is a rule-based heuristic text-line parser (sim/ingestion/scryfall.py), not manually reviewed. Verify before Level 4 exact-line validation use."
    ]
  },
  "abilities": [
    {
      "kind": "static",
      "text": "Flash",
      "cost": null,
      "timing_restriction": null,
      "zone_restriction": null,
      "alternative_cost": null
    },
    {
      "kind": "static",
      "text": "Enchant creature or Vehicle",
      "cost": null,
      "timing_restriction": null,
      "zone_restriction": null,
      "alternative_cost": null
    },
    {
      "kind": "static",
      "text": "Enchanted permanent is a Vehicle artifact with crew 5 and it loses all other card types. (It's not a creature unless it's crewed.)",
      "cost": null,
      "timing_restriction": null,
      "zone_restriction": null,
      "alternative_cost": null
    }
  ],
  "tutor_restrictions": null,
  "commander_interactions": [],
  "rulings": [
    {
      "date": "2022-02-18",
      "text": "The permanent keeps all of its abilities. Notably, if Swift Reconfiguration enchants a Vehicle, that Vehicle gains crew 5 in addition to any crew abilities it already had.",
      "source": "scryfall_rulings"
    },
    {
      "date": "2022-02-18",
      "text": "If the enchanted permanent was attacking or blocking (or being attacked if it's a planeswalker) when Swift Reconfiguration becomes attached to it, that permanent is removed from combat.",
      "source": "scryfall_rulings"
    },
    {
      "date": "2022-02-18",
      "text": "If Swift Reconfiguration becomes attached to a creature that is also a planeswalker, that permanent loses its planeswalker type. Its controller may still activate its loyalty abilities as normal, but it can't be attacked and damage dealt to it doesn't remove loyalty counters.",
      "source": "scryfall_rulings"
    },
    {
      "date": "2022-02-18",
      "text": "If Swift Reconfiguration becomes attached to a creature that is also an Equipment, that permanent becomes a Vehicle and loses the Equipment subtype. If it is attached to a creature, it becomes unattached from that creature.",
      "source": "scryfall_rulings"
    }
  ],
  "legalities": {
    "standard": "not_legal",
    "future": "not_legal",
    "historic": "not_legal",
    "timeless": "not_legal",
    "gladiator": "not_legal",
    "pioneer": "not_legal",
    "modern": "not_legal",
    "legacy": "legal",
    "pauper": "not_legal",
    "vintage": "legal",
    "penny": "not_legal",
    "commander": "legal",
    "oathbreaker": "legal",
    "standardbrawl": "not_legal",
    "brawl": "not_legal",
    "competitivebrawl": "not_legal",
    "alchemy": "not_legal",
    "paupercommander": "not_legal",
    "duel": "legal",
    "oldschool": "not_legal",
    "premodern": "not_legal",
    "predh": "not_legal",
    "tlr": "legal"
  },
  "source_pull_date": "2026-08-12",
  "source_version": "scryfall-live-2026-08-12"
}
