{
  "scryfall_id": "bf9fecfd-d122-422f-bd0a-5bf69b434dfe",
  "mtgjson_uuid": null,
  "name": "Mox Diamond",
  "oracle_text": "If this artifact would enter, you may discard a land card instead. If you do, put this artifact onto the battlefield. If you don't, put it into its owner's graveyard.\n{T}: Add one mana of any color.",
  "type_line": "Artifact",
  "color_identity": [],
  "mana_cost": "{0}",
  "mana_value": 0.0,
  "characteristics": {
    "card_types": [
      "Artifact"
    ],
    "subtypes": [],
    "supertypes": [],
    "is_mana_source": true,
    "is_creature": false,
    "is_permanent": true,
    "power": null,
    "toughness": null,
    "produces_convoke_eligible": false,
    "notes": [
      "Ability `kind` classification is a rule-based heuristic text-line parser (sim/ingestion/scryfall.py), not manually reviewed. Verify before Level 4 exact-line validation use."
    ]
  },
  "abilities": [
    {
      "kind": "replacement",
      "text": "If this artifact would enter, you may discard a land card instead. If you do, put this artifact onto the battlefield. If you don't, put it into its owner's graveyard.",
      "cost": null,
      "timing_restriction": null,
      "zone_restriction": null,
      "alternative_cost": null
    },
    {
      "kind": "mana",
      "text": "{T}: Add one mana of any color.",
      "cost": "{T}",
      "timing_restriction": null,
      "zone_restriction": null,
      "alternative_cost": null
    }
  ],
  "tutor_restrictions": null,
  "commander_interactions": [],
  "rulings": [
    {
      "date": "2008-05-01",
      "text": "If you don't discard a land card, Mox Diamond never enters. It won't trigger abilities that look for something entering, and you won't get the opportunity to tap it for mana.",
      "source": "scryfall_rulings"
    }
  ],
  "legalities": {
    "standard": "not_legal",
    "future": "not_legal",
    "historic": "not_legal",
    "timeless": "not_legal",
    "gladiator": "not_legal",
    "pioneer": "not_legal",
    "modern": "not_legal",
    "legacy": "legal",
    "pauper": "not_legal",
    "vintage": "legal",
    "penny": "not_legal",
    "commander": "legal",
    "oathbreaker": "legal",
    "standardbrawl": "not_legal",
    "brawl": "not_legal",
    "competitivebrawl": "not_legal",
    "alchemy": "not_legal",
    "paupercommander": "not_legal",
    "duel": "banned",
    "oldschool": "not_legal",
    "premodern": "legal",
    "predh": "legal",
    "tlr": "banned"
  },
  "source_pull_date": "2026-10-30",
  "source_version": "scryfall-live-2026-10-30"
}
