{
  "scryfall_id": "a73297d2-580c-4174-a427-265f6916d09f",
  "mtgjson_uuid": null,
  "name": "Command Tower",
  "oracle_text": "{T}: Add one mana of any color in your commander's color identity.",
  "type_line": "Land",
  "color_identity": [],
  "mana_cost": "",
  "mana_value": 0.0,
  "characteristics": {
    "card_types": [
      "Land"
    ],
    "subtypes": [],
    "supertypes": [],
    "is_mana_source": true,
    "is_creature": false,
    "is_permanent": true,
    "power": null,
    "toughness": null,
    "produces_convoke_eligible": false,
    "notes": [
      "Ability `kind` classification is a rule-based heuristic text-line parser (sim/ingestion/scryfall.py), not manually reviewed. Verify before Level 4 exact-line validation use."
    ]
  },
  "abilities": [
    {
      "kind": "mana",
      "text": "{T}: Add one mana of any color in your commander's color identity.",
      "cost": "{T}",
      "timing_restriction": null,
      "zone_restriction": null,
      "alternative_cost": null
    }
  ],
  "tutor_restrictions": null,
  "commander_interactions": [],
  "rulings": [
    {
      "date": "2020-11-10",
      "text": "If you don't have a commander, Command Tower's ability produces no mana.",
      "source": "scryfall_rulings"
    },
    {
      "date": "2020-11-10",
      "text": "If you have two commanders, the ability adds one mana of any color in their combined color identities.",
      "source": "scryfall_rulings"
    },
    {
      "date": "2020-11-10",
      "text": "If your commander is a card that has no colors in its color identity, Command Tower's ability produces no mana. It doesn't produce {C}.",
      "source": "scryfall_rulings"
    }
  ],
  "legalities": {
    "standard": "not_legal",
    "future": "not_legal",
    "historic": "legal",
    "timeless": "legal",
    "gladiator": "legal",
    "pioneer": "legal",
    "modern": "legal",
    "legacy": "legal",
    "pauper": "legal",
    "vintage": "legal",
    "penny": "not_legal",
    "commander": "legal",
    "oathbreaker": "legal",
    "standardbrawl": "legal",
    "brawl": "legal",
    "competitivebrawl": "legal",
    "alchemy": "legal",
    "paupercommander": "legal",
    "duel": "legal",
    "oldschool": "not_legal",
    "premodern": "not_legal",
    "predh": "not_legal",
    "tlr": "legal"
  },
  "source_pull_date": "2026-10-30",
  "source_version": "scryfall-live-2026-10-30"
}
