{
  "scryfall_id": "6ada256f-2e55-4c1f-b4d3-d7b10b498956",
  "mtgjson_uuid": null,
  "name": "Sylvan Library",
  "oracle_text": "At the beginning of your draw step, you may draw two additional cards. If you do, choose two cards in your hand drawn this turn. For each of those cards, pay 4 life or put the card on top of your library.",
  "type_line": "Enchantment",
  "color_identity": [
    "G"
  ],
  "mana_cost": "{1}{G}",
  "mana_value": 2.0,
  "characteristics": {
    "card_types": [
      "Enchantment"
    ],
    "subtypes": [],
    "supertypes": [],
    "is_mana_source": false,
    "is_creature": false,
    "is_permanent": true,
    "power": null,
    "toughness": null,
    "produces_convoke_eligible": false,
    "notes": [
      "Ability `kind` classification is a rule-based heuristic text-line parser (sim/ingestion/scryfall.py), not manually reviewed. Verify before Level 4 exact-line validation use."
    ]
  },
  "abilities": [
    {
      "kind": "triggered",
      "text": "At the beginning of your draw step, you may draw two additional cards. If you do, choose two cards in your hand drawn this turn. For each of those cards, pay 4 life or put the card on top of your library.",
      "cost": null,
      "timing_restriction": null,
      "zone_restriction": null,
      "alternative_cost": null
    }
  ],
  "tutor_restrictions": null,
  "commander_interactions": [],
  "rulings": [
    {
      "date": "2022-12-08",
      "text": "You always perform your normal draw before this ability. The normal draw occurs before anything can be placed on the stack during a player\u2019s draw step.",
      "source": "scryfall_rulings"
    },
    {
      "date": "2022-12-08",
      "text": "If you control other triggered abilities that allow you to draw cards during your draw step, you can choose to order Sylvan Library\u2019s ability before or after those abilities. Triggered abilities controlled by other players will resolve before triggered abilities you control.",
      "source": "scryfall_rulings"
    },
    {
      "date": "2022-12-08",
      "text": "Any cards drawn prior to Sylvan Library\u2019s ability resolving, including in your upkeep or in response to Sylvan Library\u2019s triggered ability, can be chosen to be put back using this effect. Sylvan Library\u2019s controller is responsible for keeping these cards distinguishable in hand, such as by keeping them separate from cards that began the turn in hand.",
      "source": "scryfall_rulings"
    },
    {
      "date": "2022-12-08",
      "text": "If you control more than one Sylvan Library, the triggered ability of each will resolve in sequence. You don\u2019t get to draw all the cards at once and then put them all back at once.",
      "source": "scryfall_rulings"
    },
    {
      "date": "2022-12-08",
      "text": "You can put back zero, one, or two cards.",
      "source": "scryfall_rulings"
    },
    {
      "date": "2022-12-08",
      "text": "If you choose to draw two cards, then replace one or more of those draws with some other effect, the rest of Sylvan Library\u2019s ability still happens. If you\u2019ve actually drawn only one card that turn, you must choose that card and either pay 4 life or put it on top of your library. If you haven\u2019t actually drawn any cards that turn, the rest of the ability has no effect.",
      "source": "scryfall_rulings"
    },
    {
      "date": "2022-12-08",
      "text": "It\u2019s not possible to take any actions between drawing the cards and choosing two cards. You can\u2019t cast the cards you drew to avoid having two cards to choose.",
      "source": "scryfall_rulings"
    }
  ],
  "legalities": {
    "standard": "not_legal",
    "future": "not_legal",
    "historic": "legal",
    "timeless": "legal",
    "gladiator": "legal",
    "pioneer": "not_legal",
    "modern": "not_legal",
    "legacy": "legal",
    "pauper": "not_legal",
    "vintage": "legal",
    "penny": "not_legal",
    "commander": "legal",
    "oathbreaker": "legal",
    "standardbrawl": "not_legal",
    "brawl": "legal",
    "competitivebrawl": "legal",
    "alchemy": "not_legal",
    "paupercommander": "not_legal",
    "duel": "legal",
    "oldschool": "not_legal",
    "premodern": "legal",
    "predh": "legal",
    "tlr": "legal"
  },
  "source_pull_date": "2026-08-12",
  "source_version": "scryfall-live-2026-08-12"
}
