{
  "scryfall_id": "71384418-173a-4f77-adab-56e52fa23692",
  "mtgjson_uuid": null,
  "name": "Delighted Halfling",
  "oracle_text": "{T}: Add {C}.\n{T}: Add one mana of any color. Spend this mana only to cast a legendary spell, and that spell can't be countered.",
  "type_line": "Creature \u2014 Halfling Citizen",
  "color_identity": [
    "G"
  ],
  "mana_cost": "{G}",
  "mana_value": 1.0,
  "characteristics": {
    "card_types": [
      "Creature"
    ],
    "subtypes": [
      "Halfling",
      "Citizen"
    ],
    "supertypes": [],
    "is_mana_source": true,
    "is_creature": true,
    "is_permanent": true,
    "power": "1",
    "toughness": "2",
    "produces_convoke_eligible": true,
    "notes": [
      "Ability `kind` classification is a rule-based heuristic text-line parser (sim/ingestion/scryfall.py), not manually reviewed. Verify before Level 4 exact-line validation use."
    ]
  },
  "abilities": [
    {
      "kind": "mana",
      "text": "{T}: Add {C}.",
      "cost": "{T}",
      "timing_restriction": null,
      "zone_restriction": null,
      "alternative_cost": null
    },
    {
      "kind": "mana",
      "text": "{T}: Add one mana of any color. Spend this mana only to cast a legendary spell, and that spell can't be countered.",
      "cost": "{T}",
      "timing_restriction": null,
      "zone_restriction": null,
      "alternative_cost": null
    }
  ],
  "tutor_restrictions": null,
  "commander_interactions": [],
  "rulings": [
    {
      "date": "2023-06-16",
      "text": "If the legendary spell you cast this way is copied, the copy can be countered.",
      "source": "scryfall_rulings"
    },
    {
      "date": "2023-06-16",
      "text": "The legendary spell can't be countered if the mana produced by Delighted Halfling is spent to pay any portion of the spell's cost, even an additional cost or an alternative cost. This is true even if you pay an additional cost while casting a spell \"without paying its mana cost.\"",
      "source": "scryfall_rulings"
    }
  ],
  "legalities": {
    "standard": "not_legal",
    "future": "not_legal",
    "historic": "legal",
    "timeless": "legal",
    "gladiator": "legal",
    "pioneer": "not_legal",
    "modern": "legal",
    "legacy": "legal",
    "pauper": "not_legal",
    "vintage": "legal",
    "penny": "not_legal",
    "commander": "legal",
    "oathbreaker": "legal",
    "standardbrawl": "not_legal",
    "brawl": "legal",
    "competitivebrawl": "legal",
    "alchemy": "not_legal",
    "paupercommander": "not_legal",
    "duel": "legal",
    "oldschool": "not_legal",
    "premodern": "not_legal",
    "predh": "not_legal",
    "tlr": "legal"
  },
  "source_pull_date": "2026-10-30",
  "source_version": "scryfall-live-2026-10-30"
}
