{
  "scryfall_id": "be981eef-9dd2-4233-82c9-03f9f2e82c59",
  "mtgjson_uuid": null,
  "name": "Divining Witch",
  "oracle_text": "{1}{B}, {T}, Discard a card: Choose a card name. Exile the top six cards of your library, then reveal cards from the top of your library until you reveal a card with the chosen name. Put that card into your hand and exile all other cards revealed this way.",
  "type_line": "Creature \u2014 Human Spellshaper",
  "color_identity": [
    "B"
  ],
  "mana_cost": "{1}{B}",
  "mana_value": 2.0,
  "characteristics": {
    "card_types": [
      "Creature"
    ],
    "subtypes": [
      "Human",
      "Spellshaper"
    ],
    "supertypes": [],
    "is_mana_source": false,
    "is_creature": true,
    "is_permanent": true,
    "power": "1",
    "toughness": "1",
    "produces_convoke_eligible": true,
    "notes": [
      "Ability `kind` classification is a rule-based heuristic text-line parser (sim/ingestion/scryfall.py), not manually reviewed. Verify before Level 4 exact-line validation use."
    ]
  },
  "abilities": [
    {
      "kind": "activated",
      "text": "{1}{B}, {T}, Discard a card: Choose a card name. Exile the top six cards of your library, then reveal cards from the top of your library until you reveal a card with the chosen name. Put that card into your hand and exile all other cards revealed this way.",
      "cost": "{1}{B}, {T}, Discard a card",
      "timing_restriction": null,
      "zone_restriction": null,
      "alternative_cost": null
    }
  ],
  "tutor_restrictions": null,
  "commander_interactions": [],
  "rulings": [
    {
      "date": "2004-10-04",
      "text": "You name a card during resolution of the ability.",
      "source": "scryfall_rulings"
    }
  ],
  "legalities": {
    "standard": "not_legal",
    "future": "not_legal",
    "historic": "not_legal",
    "timeless": "not_legal",
    "gladiator": "not_legal",
    "pioneer": "not_legal",
    "modern": "not_legal",
    "legacy": "legal",
    "pauper": "not_legal",
    "vintage": "legal",
    "penny": "not_legal",
    "commander": "legal",
    "oathbreaker": "legal",
    "standardbrawl": "not_legal",
    "brawl": "not_legal",
    "competitivebrawl": "not_legal",
    "alchemy": "not_legal",
    "paupercommander": "not_legal",
    "duel": "legal",
    "oldschool": "not_legal",
    "premodern": "legal",
    "predh": "legal",
    "tlr": "legal"
  },
  "source_pull_date": "2026-10-30",
  "source_version": "scryfall-live-2026-10-30"
}
